{
  "audit_version": "openviking_embedding_audit.v1",
  "generated_at": "2026-03-05T05:19:18.403194+00:00",
  "doc_count": 1,
  "docs": [
    {
      "audit_version": "openviking_embedding_audit.v1",
      "doc_id": "viking://resources/user/memory/2026-03-03-orchestrator-v2.md",
      "doc_hash": "41d11244d8263ed2a289b8bc67a405610104e659f5f8646e82e7d0f5dfda2a56",
      "chunk_count_total": 7,
      "chunk_count_embedded": 7,
      "embedding_status": "ok",
      "embedding_coverage_pct": 1.0,
      "max_chunk_tokens_seen": 1000,
      "max_chunk_chars_seen": 995,
      "max_chunk_bytes_seen": 1000,
      "status_counts": {
        "ok": 7,
        "truncated": 0,
        "skipped": 0,
        "error": 0
      },
      "chunker_version": "deterministic_chunker.v2",
      "embedding_version": "openviking.default",
      "token_count_method": "safe_fallback",
      "fallback_trigger_count": 502,
      "dual_guard_trim_count": 495,
      "indexed_at": "2026-03-05T05:19:18.403050+00:00",
      "source": "ingest_index"
    }
  ]
}
