{
  "audit_version": "openviking_embedding_audit.v1",
  "generated_at": "2026-03-06T08:31:14.318818+00:00",
  "doc_count": 8,
  "docs": [
    {
      "audit_version": "openviking_embedding_audit.v1",
      "doc_id": "viking://resources/user/memory/memory_18/Memory_Bootstrap_Core_Rules/2026-03-05_Workflow_Auto-A_4more.md",
      "doc_hash": "6f573bb6309b5fe0996a92113154af8392b37e537073d89ed45e4b90234734ce",
      "chunk_count_total": 47,
      "chunk_count_embedded": 47,
      "embedding_status": "ok",
      "embedding_coverage_pct": 1.0,
      "max_chunk_tokens_seen": 800,
      "max_chunk_chars_seen": 636,
      "max_chunk_bytes_seen": 800,
      "status_counts": {
        "ok": 47,
        "truncated": 0,
        "skipped": 0,
        "error": 0
      },
      "chunker_version": "deterministic_chunker.v2",
      "embedding_version": "openviking.default",
      "token_count_method": "safe_fallback",
      "fallback_trigger_count": 11998,
      "dual_guard_trim_count": 11951,
      "indexed_at": "2026-03-06T08:31:04.808924+00:00",
      "source": "backfill"
    },
    {
      "audit_version": "openviking_embedding_audit.v1",
      "doc_id": "viking://resources/user/memory/memory_18/Memory_Bootstrap_Core_Rules/2026-03-06_SRAP_Phase_A_441282fd.md",
      "doc_hash": "2755b17bf1a65909f7d0e41509bdfd084380ac5184a19f95b27d820079b649a1",
      "chunk_count_total": 5,
      "chunk_count_embedded": 5,
      "embedding_status": "ok",
      "embedding_coverage_pct": 1.0,
      "max_chunk_tokens_seen": 798,
      "max_chunk_chars_seen": 672,
      "max_chunk_bytes_seen": 798,
      "status_counts": {
        "ok": 5,
        "truncated": 0,
        "skipped": 0,
        "error": 0
      },
      "chunker_version": "deterministic_chunker.v2",
      "embedding_version": "openviking.default",
      "token_count_method": "safe_fallback",
      "fallback_trigger_count": 91,
      "dual_guard_trim_count": 86,
      "indexed_at": "2026-03-06T08:31:05.119615+00:00",
      "source": "backfill"
    },
    {
      "audit_version": "openviking_embedding_audit.v1",
      "doc_id": "viking://resources/user/memory/memory_18/Memory_Bootstrap_Core_Rules/Active_Skills_High-Value_7more.md",
      "doc_hash": "ecb441958f8e19baeb20c0e0c2fc1af96062039cc8247cb56891b3809c768941",
      "chunk_count_total": 35,
      "chunk_count_embedded": 35,
      "embedding_status": "ok",
      "embedding_coverage_pct": 1.0,
      "max_chunk_tokens_seen": 800,
      "max_chunk_chars_seen": 771,
      "max_chunk_bytes_seen": 800,
      "status_counts": {
        "ok": 35,
        "truncated": 0,
        "skipped": 0,
        "error": 0
      },
      "chunker_version": "deterministic_chunker.v2",
      "embedding_version": "openviking.default",
      "token_count_method": "safe_fallback",
      "fallback_trigger_count": 8091,
      "dual_guard_trim_count": 8056,
      "indexed_at": "2026-03-06T08:31:05.511118+00:00",
      "source": "backfill"
    },
    {
      "audit_version": "openviking_embedding_audit.v1",
      "doc_id": "viking://resources/user/memory/memory_18/Memory_Bootstrap_Core_Rules/MVP-9_Hardening_Key_Learni_3more.md",
      "doc_hash": "2cd83159b7833963511adfbe740e8ff3e17869174f8ad6bfc74378d75b8d6b83",
      "chunk_count_total": 14,
      "chunk_count_embedded": 14,
      "embedding_status": "ok",
      "embedding_coverage_pct": 1.0,
      "max_chunk_tokens_seen": 800,
      "max_chunk_chars_seen": 696,
      "max_chunk_bytes_seen": 800,
      "status_counts": {
        "ok": 14,
        "truncated": 0,
        "skipped": 0,
        "error": 0
      },
      "chunker_version": "deterministic_chunker.v2",
      "embedding_version": "openviking.default",
      "token_count_method": "safe_fallback",
      "fallback_trigger_count": 1754,
      "dual_guard_trim_count": 1740,
      "indexed_at": "2026-03-06T08:31:05.840316+00:00",
      "source": "backfill"
    },
    {
      "audit_version": "openviking_embedding_audit.v1",
      "doc_id": "viking://resources/user/memory/memory_18/Memory_Bootstrap_Core_Rules/MVP112_Cycle_Evidence_Laye_7more.md",
      "doc_hash": "f4574262b68f386e00deb84d5002ebe9e4b9775c24a8ef5cb0ef0ef8a9a773e9",
      "chunk_count_total": 30,
      "chunk_count_embedded": 30,
      "embedding_status": "ok",
      "embedding_coverage_pct": 1.0,
      "max_chunk_tokens_seen": 800,
      "max_chunk_chars_seen": 660,
      "max_chunk_bytes_seen": 800,
      "status_counts": {
        "ok": 30,
        "truncated": 0,
        "skipped": 0,
        "error": 0
      },
      "chunker_version": "deterministic_chunker.v2",
      "embedding_version": "openviking.default",
      "token_count_method": "safe_fallback",
      "fallback_trigger_count": 2137,
      "dual_guard_trim_count": 2107,
      "indexed_at": "2026-03-06T08:31:06.204853+00:00",
      "source": "backfill"
    },
    {
      "audit_version": "openviking_embedding_audit.v1",
      "doc_id": "viking://resources/user/memory/memory_18/Memory_Bootstrap_Core_Rules/Memory_Bootstrap_Core_Rule_6more.md",
      "doc_hash": "6e9bd4cdccd26df7bbfb4bf52c34374aeed83dfa415bcb6bc84eaae74b3b13b7",
      "chunk_count_total": 23,
      "chunk_count_embedded": 23,
      "embedding_status": "ok",
      "embedding_coverage_pct": 1.0,
      "max_chunk_tokens_seen": 800,
      "max_chunk_chars_seen": 791,
      "max_chunk_bytes_seen": 800,
      "status_counts": {
        "ok": 23,
        "truncated": 0,
        "skipped": 0,
        "error": 0
      },
      "chunker_version": "deterministic_chunker.v2",
      "embedding_version": "openviking.default",
      "token_count_method": "safe_fallback",
      "fallback_trigger_count": 4149,
      "dual_guard_trim_count": 4126,
      "indexed_at": "2026-03-06T08:31:06.584112+00:00",
      "source": "backfill"
    },
    {
      "audit_version": "openviking_embedding_audit.v1",
      "doc_id": "viking://resources/user/memory/memory_18/Memory_Bootstrap_Core_Rules/Memory_Retrieve_v12_OpenVi_6more.md",
      "doc_hash": "a372e85df8fca1399787c215db8d63ab00f6e50c31d553fc8ad9766b4acc99e3",
      "chunk_count_total": 28,
      "chunk_count_embedded": 28,
      "embedding_status": "ok",
      "embedding_coverage_pct": 1.0,
      "max_chunk_tokens_seen": 800,
      "max_chunk_chars_seen": 679,
      "max_chunk_bytes_seen": 800,
      "status_counts": {
        "ok": 28,
        "truncated": 0,
        "skipped": 0,
        "error": 0
      },
      "chunker_version": "deterministic_chunker.v2",
      "embedding_version": "openviking.default",
      "token_count_method": "safe_fallback",
      "fallback_trigger_count": 7429,
      "dual_guard_trim_count": 7401,
      "indexed_at": "2026-03-06T08:31:06.929488+00:00",
      "source": "backfill"
    },
    {
      "audit_version": "openviking_embedding_audit.v1",
      "doc_id": "viking://resources/user/memory/memory_18/Memory_Bootstrap_Core_Rules/僵尸任务清理机制_2026-03-04_6more.md",
      "doc_hash": "37febca288940bee9a6a80db2aad10e10b3e3efb78bbb9c69b5d2ed82edff220",
      "chunk_count_total": 30,
      "chunk_count_embedded": 30,
      "embedding_status": "ok",
      "embedding_coverage_pct": 1.0,
      "max_chunk_tokens_seen": 800,
      "max_chunk_chars_seen": 800,
      "max_chunk_bytes_seen": 800,
      "status_counts": {
        "ok": 30,
        "truncated": 0,
        "skipped": 0,
        "error": 0
      },
      "chunker_version": "deterministic_chunker.v2",
      "embedding_version": "openviking.default",
      "token_count_method": "safe_fallback",
      "fallback_trigger_count": 2869,
      "dual_guard_trim_count": 2839,
      "indexed_at": "2026-03-06T08:31:07.257797+00:00",
      "source": "backfill"
    }
  ]
}
